{
  "snapshot_version": 1,
  "first_row": 2,
  "last_row": 28,
  "text": " fixture     empty                             0  alpha.txt\n home        nested                            2  notes café.txt\n temp        occupied                          1\n             alpha.txt                      57 B\n             bravo.txt                      28 B\n             long.txt                     3.96 k\n             protected.txt                  32 B\n"
}
