{
  "snapshot_version": 1,
  "first_row": 4,
  "last_row": 20,
  "text": "│ (/) Type something                             │\n│   alpha.txt                                    │\n│\u003e  bravo.txt                                    │\n│   charlie.txt                                  │\n│   long.txt                                     │\n│   occupied.txt                                 │\n│   protected.txt                                │\n│   scroll-00.txt                                │\n│   scroll-01.txt                                │\n│   scroll-02.txt                                │\n│   scroll-03.txt                                │\n│   scroll-04.txt                                │\n│   scroll-05.txt                                │\n│   scroll-06.txt                                │\n│   scroll-07.txt                                │\n│   scroll-08.txt                                │\n│   scroll-09.txt                                │\n"
}
